name,,,,location,state
PSG Institutions,,,,Coimbatore,Tamil Nadu
KMCH Institutions,,,,Coimbatore,Tamil Nadu
Karpagam Institutions.,,,,Coimbatore,Tamil Nadu
Sri Krishna Institutions.,,,,Coimbatore,Tamil Nadu
PPG Group Of Institution,,,,Coimbatore,Tamil Nadu
SRM University Chennai,,,,Chennai,Tamil Nadu
Vels University Chennai,,,,Chennai,Tamil Nadu
Vellalar College Of Education,,,,Erode,Tamil Nadu
Hindustan University chennai,,,,Chennai,Tamil Nadu
Sriramakrishna Colleges.,,,,Coimbatore,Tamil Nadu
Salem Polyclinic Hospital,,,,Salem,Tamil Nadu
Nehru Group Of Institutions.,,,,Coimbatore,Tamil Nadu
Adithya Institute,,,,Coimbatore,Tamil Nadu
Paavai College,,,,Chennai,Tamil Nadu
Coimbatore Institute of Technology,,,,Coimbatore,Tamil Nadu
Hindustan Educational Institutions,,,,Coimbatore,Tamil Nadu
DR. NGP College of Educations,,,,Coimbatore,Tamil Nadu
Revathi Group of Institutions,,,,Coimbatore,Tamil Nadu
United Group of Institutions.,,,,Coimbatore,Tamil Nadu
Shri BharaniCollege Of Nursing,,,,Salem,Tamil Nadu
Coimbatore Marine College (CMC),,,,Coimbatore,Tamil Nadu
Sri Lakshmi Institutions ,,,,Coimbatore,Tamil Nadu
Dharan Institute Of Medical Sciences,,,,Salem,Tamil Nadu
VG Institute Of Paramedical Sciences,,,,Coimbatore,Tamil Nadu
Excel Group Of Institutions ,,,,Salem,Tamil Nadu
Erode Sengunthar Engineering College,,,,Erode,Tamil Nadu
Shree Venkateshwara Institutions (Gopi),,,,Thirupathy,Tamil Nadu
Tamil Nadu College of Engineering,,,,Coimbatore,Tamil Nadu
CMS College Of Science & Commerce,,,,Coimbatore,Tamil Nadu
AMC College of Nursing,,,,Coimbatore,Tamil Nadu
Shanmugha Institute Of Medical Sciences.,,,,Coimbatore,Tamil Nadu
KSR Educational Institutions,,,,Chennai,Tamil Nadu
Mahendra institutions ,,,,Nammakal,Tamil Nadu
Nandha Educational Institutions ,,,,Nammakal,Tamil Nadu
Vineyaka Missions University ,,,,Erode,Tamil Nadu
RVS Group of institutions ,,,,Salem,Tamil Nadu
Kumaraguru College of Technology,,,,Coimbatore,Tamil Nadu
Shevaroys College Of Hotel Management,,,,Tirupur,Tamil Nadu
International Maritime Academy ,,,,Salem,Tamil Nadu
Sri Shakthi Institute of Engineering and Technology,,,,Chennai,Tamil Nadu
JKK Munirajah Educational Institutions ,,,,Coimbatore,Tamil Nadu
EASA College of Engineering and Technology,,,,Nammakal,Tamil Nadu
JCT College of Engineering and Technology,,,,Coimbatore,Tamil Nadu
Park College of Engineering and Technology,,,,Coimbatore,Tamil Nadu
Vivekanandha Educational Institutions ,,,,Coimbatore,Tamil Nadu
Maharaja Group Of Institutions ,,,,Nammakal,Tamil Nadu
VLB Janakiammal College Of Engineering & Technology,,,,Coimbatore,Tamil Nadu
Dhanalakshmi Srinivasan Group Of Institutions,,,,Coimbatore,Tamil Nadu
MIT College Of Agriculture,,,,Coimbatore,Tamil Nadu
Sai Institute Of Nursing,,,,Thiruchirappalli,Tamil Nadu
ENNAM Institutions.,,,,Coimbatore,Tamil Nadu
Annai Meenakshi College,,,,Solavampalayam,Tamil Nadu
Nightingate Institute.,,,,Coimbatore,Tamil Nadu
AJK group of institutions,,,,Coimbatore,Tamil Nadu
Sree Narayana Guru College,,,,Coimbatore,Tamil Nadu
